{
  "agent": "hr_agent",
  "story": "nwaters plans time off around the 2025 public holidays and wants payroll to confirm the days.",
  "starting_sentence": "What is my time off schedule for 2025? My username is nwaters.",
  "user_prompts": [
    "Which public holidays are there in 2025?",
    "Please confirm the days with payroll.",
    "How many vacation days do new employees get?"
  ],
  "goals": {
    "fetch_id-1": [
      "get_timeoff-1",
      "holidays-1"
    ],
    "get_timeoff-1": [
      "payroll_handoff-1"
    ],
    "holidays-1": [
      "payroll_handoff-1"
    ],
    "payroll_handoff-1": [
      "kb_answer-1"
    ],
    "kb_answer-1": [
      "summarize"
    ]
  },
  "goal_details": [
    {
      "type": "tool_call",
      "name": "fetch_id-1",
      "tool_name": "fetch_assignment_id",
      "args": {
        "username": "nwaters"
      }
    },
    {
      "type": "tool_call",
      "name": "get_timeoff-1",
      "tool_name": "retrieve_timeoff_schedule",
      "args": {
        "assignment_id": "15338303",
        "start_date": "2025-01-01",
        "end_date": "2025-12-31"
      },
      "arg_matching": {
        "start_date": "fuzzy",
        "end_date": "optional"
      }
    },
    {
      "type": "tool_call",
      "name": "holidays-1",
      "tool_name": "get_holiday_calendar",
      "args": {
        "year": 2025
      }
    },
    {
      "type": "tool_call",
      "name": "payroll_handoff-1",
      "tool_name": "chat_with_collaborator_payroll_agent",
      "args": {
        "message": "Confirm time off for assignment 15338303 in 2025"
      },
      "arg_matching": {
        "message": "fuzzy"
      }
    },
    {
      "type": "conversational_search",
      "name": "kb_answer-1",
      "response": "New employees get 20 vacation days per year."
    },
    {
      "type": "text",
      "name": "summarize",
      "response": "New employees get 20 vacation days; your 2025 time off is confirmed by payroll.",
      "keywords": [
        "20"
      ]
    }
  ],
  "x_agent_evals": {
    "forbidden_tools": [
      "delete_employee"
    ],
    "max_latency_s": 45.5,
    "judge_notes": "the answer must say that payroll confirmed the days",
    "repeat": 3
  }
}
